{
  "expert_id": "hina",
  "expert_name": "陽菜",
  "school": "穴党・逆張り",
  "backend": "claude-haiku (gemini-fallback)",
  "effort": "high",
  "race_id": "202609030411",
  "pack_version": "v1",
  "predicted_ranking": [
    { "horse_num": 17, "rank": 1 },
    { "horse_num": 5, "rank": 2 },
    { "horse_num": 2, "rank": 3 },
    { "horse_num": 16, "rank": 4 },
    { "horse_num": 6, "rank": 5 },
    { "horse_num": 1, "rank": 6 },
    { "horse_num": 15, "rank": 7 },
    { "horse_num": 14, "rank": 8 }
  ],
  "win_prob": [
    { "horse_num": 17, "prob": 0.28 },
    { "horse_num": 5, "prob": 0.22 },
    { "horse_num": 2, "prob": 0.18 },
    { "horse_num": 16, "prob": 0.12 },
    { "horse_num": 6, "prob": 0.08 },
    { "horse_num": 1, "prob": 0.05 },
    { "horse_num": 15, "prob": 0.04 },
    { "horse_num": 14, "prob": 0.03 }
  ],
  "place_prob": [
    { "horse_num": 17, "prob": 0.58 },
    { "horse_num": 5, "prob": 0.52 },
    { "horse_num": 2, "prob": 0.48 },
    { "horse_num": 16, "prob": 0.38 },
    { "horse_num": 6, "prob": 0.32 },
    { "horse_num": 1, "prob": 0.25 },
    { "horse_num": 15, "prob": 0.22 },
    { "horse_num": 14, "prob": 0.18 }
  ],
  "marks": {
    "honmei": 17,
    "taikou": 5,
    "tanana": 2,
    "renka": [16, 6, 1]
  },
  "confidence": 0.62,
  "rationale": "穴党として1番人気クロワデュノールを外す。天皇賞春勝利後、調教師が『動き重い』と評価。半年の短期で重馬場対応は不透明。メイショウタバル連覇は大阪杯2着で前走から下降気配。本命層の不安定さを突き、実力馬レガレイラ（G1 3勝）に着目。G1 4勝目『名牝の系譜入り』の底力、『夏は牝馬57.1%勝率』データ、梅雨期適性の実績で急浮上。",
  "data_used": [
    "pack-v1.odds",
    "天皇賞春2026成績・調教",
    "有馬記念2025成績",
    "大阪杯2026成績",
    "宝塚記念牝馬データ",
    "阪神芝2200m馬場リニューアル情報",
    "梅雨期G1適性"
  ],
  "warnings": [
    "前日オッズ未確定。本予想は前日夜時点の仮説。",
    "梅雨入り後のため当日馬場変動に注意。",
    "レガレイラは牝馬（56.0kg）で斤量有利。",
    "ミュージアムマイルは半年ぶりの実戦。仕上がり次第で評価大変動の可能性。"
  ]
}
