{
  "expert_id": "misaki",
  "expert_name": "美咲",
  "school": "展開",
  "backend": "claude-opus",
  "effort": "medium",
  "race_id": "202609030411",
  "pack_version": "v1",
  "predicted_ranking": [
    { "horse_num": 5, "rank": 1 },
    { "horse_num": 16, "rank": 2 },
    { "horse_num": 2, "rank": 3 },
    { "horse_num": 1, "rank": 4 },
    { "horse_num": 17, "rank": 5 }
  ],
  "win_prob": [
    { "horse_num": 5, "prob": 0.30 },
    { "horse_num": 16, "prob": 0.17 },
    { "horse_num": 2, "prob": 0.15 },
    { "horse_num": 1, "prob": 0.10 },
    { "horse_num": 17, "prob": 0.08 },
    { "horse_num": 15, "prob": 0.05 },
    { "horse_num": 6, "prob": 0.04 },
    { "horse_num": 4, "prob": 0.03 },
    { "horse_num": 14, "prob": 0.02 },
    { "horse_num": 9, "prob": 0.02 }
  ],
  "place_prob": [
    { "horse_num": 5, "prob": 0.65 },
    { "horse_num": 16, "prob": 0.48 },
    { "horse_num": 2, "prob": 0.42 },
    { "horse_num": 1, "prob": 0.30 },
    { "horse_num": 17, "prob": 0.25 },
    { "horse_num": 15, "prob": 0.15 },
    { "horse_num": 6, "prob": 0.12 },
    { "horse_num": 4, "prob": 0.10 },
    { "horse_num": 9, "prob": 0.08 },
    { "horse_num": 14, "prob": 0.07 }
  ],
  "marks": {
    "honmei": 5,
    "taikou": 16,
    "tanana": 2,
    "renka": [1, 17, 15]
  },
  "confidence": 0.62,
  "rationale": "想定ラップ: 12.5-12.3-11.8-12.0-12.3-12.0-11.8-11.6-11.5-11.8-12.0（2:11.6前後）。メイショウタバル単騎逃げ濃厚、1000m通過59.0-59.5秒の平均ペース想定。3-4角からのロングスパート戦で、中団好位から持続力で押し切れるクロワデュノールが最有力。大阪杯・天皇賞春と同パターンで3-4角外から長く脚を使い差し切る形。メイショウタバルは昨年同様の単騎逃げで粘り込み2着候補。ミュージアムマイルは末脚鋭いが内枠発走で包まれるリスクあり、展開が向けば突き抜ける力はある。ペース速化時はミュージアムマイル・レガレイラ浮上、スロー時はクロワデュノール・メイショウタバルで堅い。両シナリオで残るクロワデュノール本命。",
  "data_used": [
    "pack-v1.json",
    "宝塚記念過去ラップ(2024-2025)",
    "大阪杯2026結果",
    "天皇賞春2026結果",
    "有馬記念2025結果",
    "各馬脚質・近走成績(web)",
    "阪神芝馬場情報(2026年6月)"
  ],
  "warnings": [
    "梅雨入り後のため当日馬場悪化の場合は差し・追込有利にシフトし、レガレイラ・ミュージアムマイルの評価上昇要因となる",
    "past_racesデータ未提供のためweb調査に依存。一部馬の近走詳細が不完全",
    "ミュージアムマイルの大阪杯2026着順が複数情報源で不一致のため確認要"
  ]
}
