{
  "expert_id": "aoi",
  "expert_name": "葵",
  "school": "騎手",
  "backend": "claude-sonnet",
  "effort": "medium",
  "race_id": "202609030411",
  "pack_version": "v1",
  "predicted_ranking": [
    { "horse_num": 5,  "rank": 1 },
    { "horse_num": 16, "rank": 2 },
    { "horse_num": 2,  "rank": 3 },
    { "horse_num": 17, "rank": 4 },
    { "horse_num": 14, "rank": 5 }
  ],
  "win_prob": [
    { "horse_num": 5,  "prob": 0.32 },
    { "horse_num": 16, "prob": 0.20 },
    { "horse_num": 2,  "prob": 0.14 },
    { "horse_num": 17, "prob": 0.10 },
    { "horse_num": 1,  "prob": 0.07 },
    { "horse_num": 14, "prob": 0.05 }
  ],
  "place_prob": [
    { "horse_num": 5,  "prob": 0.65 },
    { "horse_num": 16, "prob": 0.52 },
    { "horse_num": 2,  "prob": 0.42 },
    { "horse_num": 17, "prob": 0.35 },
    { "horse_num": 1,  "prob": 0.25 },
    { "horse_num": 14, "prob": 0.22 }
  ],
  "marks": {
    "honmei": 5,
    "taikou": 16,
    "tanana": 2,
    "renka": [17, 14, 1]
  },
  "confidence": 0.62,
  "rationale": "◎クロワデュノール（北村友一/斉藤崇史・栗東）：2026年大阪杯・天皇賞春を連勝し春古馬4冠目を狙う。阪神コースでの大阪杯G1勝利実績があり、栗東所属の地の利も万全。北村友一とのコンビ成績は今季G1二桁騎乗で最良。○メイショウタバル（武豊/石橋守・栗東）：2025年宝塚記念制覇、武豊の阪神芝2200m G1実績は圧倒的（5勝）。逃げ馬の戦法と1枠有利。栗東仕上げ。▲ミュージアムマイル（D.レーン/高柳大輔・美浦）：有馬記念勝馬でレーンとのコンビ再結成。レーン自身が馬の成長を高評価。ただし美浦東上馬で栗東比やや不利。△レガレイラ（ルメール/木村哲也・美浦）：エリザベス女王杯勝馬、牝馬56kg斤量利。ルメールの阪神2200m複勝実績あり。",
  "data_used": [
    "pack-v1.json",
    "web:騎手G1実績（武豊/北村友一/川田将雅/ルメール/D.レーン）",
    "web:2026年大阪杯・天皇賞春結果（クロワデュノール北村友一）",
    "web:2025年宝塚記念結果（メイショウタバル武豊逃げ切り）",
    "web:阪神芝2200m騎手データ（岩田望来1位/川田/武豊）",
    "web:ミュージアムマイルD.レーン宝塚記念コメント",
    "web:レガレイラ2025エリザベス女王杯勝利実績"
  ],
  "warnings": [
    "past_races / training フィールドが空のため馬の近走成績は騎手・厩舎実績ベースで推定",
    "梅雨期の馬場状態（良→稍重変動）は当日確認要。武豊×メイショウタバルは稍重で2025年宝塚記念勝利実績あり",
    "ミュージアムマイルは有馬記念でC.デムーロ騎乗（D.レーンではなかった）。乗り替わり評価に注意",
    "美浦所属馬（2番・17番）は栗東比で阪神への輸送不利を考慮"
  ]
}
