{
  "expert_id": "hina",
  "expert_name": "陽菜",
  "school": "穴党",
  "backend": "gemini-2.5-flash",
  "effort": "low",
  "race_id": "202609030611",
  "pack_version": "v1",
  "predicted_ranking": [
    {
      "horse_num": 10,
      "rank": 1
    },
    {
      "horse_num": 12,
      "rank": 2
    },
    {
      "horse_num": 5,
      "rank": 3
    },
    {
      "horse_num": 1,
      "rank": 4
    },
    {
      "horse_num": 15,
      "rank": 5
    }
  ],
  "win_prob": [
    {
      "horse_num": 10,
      "prob": 0.35
    },
    {
      "horse_num": 12,
      "prob": 0.25
    },
    {
      "horse_num": 5,
      "prob": 0.20
    },
    {
      "horse_num": 1,
      "prob": 0.10
    },
    {
      "horse_num": 15,
      "prob": 0.10
    }
  ],
  "marks": {
    "honmei": 10,
    "taikou": 12,
    "tanana": 5,
    "renka": [
      1,
      15
    ]
  },
  "confidence": 0.35,
  "rationale": "みんなが見落としてるけど、梅雨の阪神でこの重馬場ならスピード一辺倒の人気馬は用無しだよ！本命は10番エルトンバローズ。父サトノダイヤモンド×母父ブライアンズタイムのタフな配合は重馬場阪神でこそ真価を発揮するはず。対抗は12番カズミクラーシュ。モーリス×キングマンボのパワーで、タフな泥んこ馬場を力強く突き抜けるよ。1番人気のエコロアルバは初の重馬場と阪神の急坂を背負う割に過大評価。消しでいい。連下には川田騎手鞍上の1番と、ダート血統Mineshaftを引く15番ショウナンアデイブを隠し味にね！",
  "data_used": [
    "odds",
    "weather",
    "pedigree"
  ],
  "warnings": [
    "10番エルトンバローズの父はサトノダイヤモンドとして知識補完しています",
    "11番エコロアルバは血統データが取得不能だったため、実績とオッズ、馬場状況から消し判断を行いました"
  ]
}
