{
  "expert_id": "kenta",
  "expert_name": "健太",
  "school": "指数",
  "backend": "claude-sonnet",
  "effort": "low",
  "race_id": "202609030611",
  "pack_version": "v1",
  "predicted_ranking": [
    {
      "horse_num": 11,
      "rank": 1
    },
    {
      "horse_num": 5,
      "rank": 2
    },
    {
      "horse_num": 8,
      "rank": 3
    },
    {
      "horse_num": 14,
      "rank": 4
    },
    {
      "horse_num": 10,
      "rank": 5
    }
  ],
  "win_prob": [
    {
      "horse_num": 11,
      "prob": 0.34
    },
    {
      "horse_num": 5,
      "prob": 0.24
    },
    {
      "horse_num": 8,
      "prob": 0.19
    },
    {
      "horse_num": 14,
      "prob": 0.12
    },
    {
      "horse_num": 10,
      "prob": 0.08
    }
  ],
  "marks": {
    "honmei": 11,
    "taikou": 5,
    "tanana": 8,
    "renka": [
      14,
      10
    ]
  },
  "confidence": 0.45,
  "rationale": "重馬場×阪神1600mで道悪実績を最重視。◎11エコロアルバ：朝日杯FS（阪神重4着）換算SI=85.4は今回と完全同条件での証明値。斤量53kg(+4kg分補正済み)も有利。○5ファーヴェント：ダービー卿CT稍重3着換算SI=86.6が直近最高値、近4走全て1600m専念で安定。▲8サイルーン：同レース推定1着でSI=86.6だが7歳・レース特定データ不確実。11と5・8の差は約1〜2pt で上位横一線気味だが、阪神重の直接実証実績でエコロアルバを頭に抜擢。",
  "data_used": [
    "winsight.jp/db/horse_race_result: エコロアルバ(2023103184), ファーヴェント(2021104893), ミニトランザット(2022105230), エルトンバローズ(2020100680), サイルーン(2019104838), ファンダム(2022105836), カズミクラーシュ(2021105564)",
    "s.keibabook.co.jp/db/uma/0951718/top: エコロアルバ成績確認",
    "race.netkeiba.com/race/result.html?race_id=202605010411: 東京新聞杯2026全着順",
    "web_search: 朝日杯FS2025, NHKマイルC2026, ダービー卿CT2026 各レース結果・馬場情報",
    "pack-v1.json: オッズ・斤量・騎手・血統"
  ],
  "warnings": [
    "pack-v1.json の horses[].past_races が全頭空配列のため外部webデータで代替（走破時計推定値）",
    "スマートワイス・ファインライン・メイショウシンタケ・シンフォーエバー・キープカルム・スイープアワーズ・ショウナンアデイブ・スリールミニョン・タガノエルピーダの指数データ取得不能、ランク付け対象外",
    "ブエナオンダ: 東京新聞杯2026 15着(1:33.0 東京良)確認のみ、換算SI≈67",
    "サイルーン前走（26/04/04 中山芝1600m 1着 1:33.4）がダービー卿CT(G3稍重)か同日別クラスか未確認。G3想定SI=86.6、別クラス想定SI≈77",
    "ファンダム: 直近1600m実績は前々々走シンザン記念(推定)3着1:32.3のみで指数信頼性低、前走は1400m8着と距離不安定",
    "SI計算は推定基準タイム(阪神芝1600m良=1:33.0)・コース補正・馬場補正を使った簡易指数。公式JRAスピード指数ではない",
    "斤量補正: 57kg基準・1kg=0.15秒換算適用（エコロアルバ53kgに対し+0.6秒の遅化補正済み）"
  ]
}
