{"expert_id":"makoto","expert_name":"誠","school":"統計","backend":"codex-gpt-5.5","effort":"high","race_id":"202609030611","pack_version":"v1","predicted_ranking":[{"horse_num":11,"rank":1},{"horse_num":5,"rank":2},{"horse_num":14,"rank":3},{"horse_num":9,"rank":4},{"horse_num":8,"rank":5},{"horse_num":10,"rank":6},{"horse_num":12,"rank":7},{"horse_num":17,"rank":8},{"horse_num":7,"rank":9},{"horse_num":1,"rank":10},{"horse_num":15,"rank":11},{"horse_num":4,"rank":12},{"horse_num":18,"rank":13},{"horse_num":16,"rank":14},{"horse_num":2,"rank":15},{"horse_num":13,"rank":16},{"horse_num":6,"rank":17},{"horse_num":3,"rank":18}],"win_prob":[{"horse_num":11,"prob":0.1817},{"horse_num":5,"prob":0.1426},{"horse_num":14,"prob":0.116},{"horse_num":9,"prob":0.0821},{"horse_num":8,"prob":0.0796},{"horse_num":10,"prob":0.0601},{"horse_num":12,"prob":0.0576},{"horse_num":17,"prob":0.0571},{"horse_num":7,"prob":0.0537},{"horse_num":1,"prob":0.0377},{"horse_num":15,"prob":0.0276},{"horse_num":4,"prob":0.0233},{"horse_num":18,"prob":0.0226},{"horse_num":16,"prob":0.0161},{"horse_num":2,"prob":0.0156},{"horse_num":13,"prob":0.0137},{"horse_num":6,"prob":0.0072},{"horse_num":3,"prob":0.0058}],"marks":{"honmei":11,"taikou":5,"tanana":14,"renka":[9,8,10,12,17]},"confidence":0.45,"rationale":"S=-ln単勝+0.18(4-5歳)+0.13(8枠)-0.18(1枠)-0.12(7歳上)。上位S:11=-1.386,5=-1.628,14=-1.835,9=-2.181,8=-2.212。","data_used":["RaceDataPack v1: 馬番・枠・年齢・斤量・単勝オッズ","web確認: netkeiba しらさぎS出馬表 race_id=202609030611 の馬番・枠・性齢・コース情報","web検索: 宝塚記念過去10年の年齢別・枠別・前走別3着内率表を探索"],"warnings":["宝塚記念の過去10年3着内率表は一次データとして安定取得できず、具体率ではなく小幅なロジット加減点で代替した。","RaceDataPackのpast_racesが空のため、前走G1出走・前走G1着順・スピード指数は全馬中立扱い。","対象レースは宝塚記念ではなく阪神芝1600m外のしらさぎSであり、宝塚記念2200m内回り傾向の転用リスクが大きい。","RaceDataPackは馬場重、web出馬表は稍重表示で不一致。馬場補正はモデルに入れていない。","netkeibaページには予想/AI表示が併載されるため、出馬表の事実情報以外は使用していない。"]}
