{
  "expert_id": "makoto",
  "expert_name": "誠",
  "school": "データ統計派",
  "backend": "claude-sonnet (codex-fallback)",
  "effort": "high",
  "race_id": "202609030411",
  "pack_version": "v1",
  "predicted_ranking": [
    { "horse_num": 5, "rank": 1 },
    { "horse_num": 16, "rank": 2 },
    { "horse_num": 2, "rank": 3 },
    { "horse_num": 17, "rank": 4 },
    { "horse_num": 1, "rank": 5 }
  ],
  "win_prob": [
    { "horse_num": 5, "prob": 0.35 },
    { "horse_num": 16, "prob": 0.18 },
    { "horse_num": 2, "prob": 0.15 },
    { "horse_num": 17, "prob": 0.10 },
    { "horse_num": 1, "prob": 0.07 },
    { "horse_num": 15, "prob": 0.03 },
    { "horse_num": 6, "prob": 0.02 },
    { "horse_num": 14, "prob": 0.02 }
  ],
  "place_prob": [
    { "horse_num": 5, "prob": 0.62 },
    { "horse_num": 16, "prob": 0.48 },
    { "horse_num": 2, "prob": 0.42 },
    { "horse_num": 17, "prob": 0.30 },
    { "horse_num": 1, "prob": 0.22 }
  ],
  "marks": {
    "honmei": 5,
    "taikou": 16,
    "tanana": 2,
    "renka": [17, 1]
  },
  "confidence": 0.62,
  "rationale": "◎クロワデュノール：キタサンブラック産駒は阪神芝内2200m勝率18.6%でトップ。G1 4連勝中（ホープフルS・日本ダービー・大阪杯・天皇賞春）。3番人気帯は過去10年最多3勝。前走天皇賞（春）勝ちは好走条件に合致。○メイショウタバル：8枠は過去10年5勝で最多。前年優勝馬の連覇は統計的にも支持されており、前走大阪杯2着で状態良好。▲ミュージアムマイル：4歳馬の複勝率28.9%は高く、有馬記念・皐月賞の2G1勝ちで実力証明。D.レーン騎乗も加点。先行有利のコースで前から9番手以内に収まる脚質が統計的に重要。",
  "data_used": [
    "pack-v1.json",
    "宝塚記念過去10年人気別成績（JRA公式・Winsight）",
    "宝塚記念過去10年枠番別成績（8枠5勝）",
    "阪神芝2200m種牡馬別成績（キタサンブラック勝率18.6%）",
    "宝塚記念過去10年脚質傾向（逃げ馬券内率40%・先行馬5勝）",
    "宝塚記念過去10年年齢別成績（4歳複勝率28.9%・5歳複勝率25.0%）",
    "クロワデュノール2026戦績（G1 4連勝：ホープフルS・日本ダービー・大阪杯・天皇賞春）",
    "メイショウタバル2026戦績（前走大阪杯2着・2025宝塚記念勝ち）",
    "ミュージアムマイル2026戦績（有馬記念2025勝ち・皐月賞2025勝ち）"
  ],
  "warnings": [
    "pack-v1.json の past_races / training フィールドが空。個別馬の近走詳細タイム・馬体重変動は未取得",
    "梅雨入り後の馬場変動（当日稍重・重化の可能性）が統計外のリスクファクターとして残存",
    "前日オッズ未確定のため人気帯の最終確認が必要",
    "codex CLI 不在のため claude-sonnet にフォールバック実行。本来の jinba-makoto-codex.sh は未実行"
  ]
}
