{"expert_id":"teppei","expert_name":"鉄平","school":"調教","backend":"codex-gpt-5.5","effort":"medium","race_id":"202609030611","pack_version":"v1","predicted_ranking":[{"horse_num":5,"rank":1},{"horse_num":14,"rank":2},{"horse_num":7,"rank":3},{"horse_num":10,"rank":4},{"horse_num":12,"rank":5},{"horse_num":17,"rank":6},{"horse_num":1,"rank":7}],"win_prob":[{"horse_num":5,"prob":0.2},{"horse_num":14,"prob":0.17},{"horse_num":7,"prob":0.15},{"horse_num":10,"prob":0.14},{"horse_num":12,"prob":0.12},{"horse_num":17,"prob":0.11},{"horse_num":1,"prob":0.11}],"marks":{"honmei":5,"taikou":14,"tanana":7,"renka":[10,12,17,1]},"confidence":0.34,"rationale":"5ファーヴェント最終時計不明も栗東A、14ミニトランザット時計不明・栗東A、7キープカルム時計不明・栗東A。10/12/17/1も栗東仕上げBで地の利を加点。","data_used":["RaceDataPack v1 出馬表、所属厩舎、斤量、単勝オッズ、阪神芝1600m重馬場情報","外部検索結果: 一次の追切時計・本数として採用可能なデータなし"],"warnings":["web検索で各馬の最終追切時計、上がり1F、併走位置、追切本数を一次データとして確認できなかった","RaceDataPackのtraining配列が全馬空のため、調教評価は栗東所属補正と当日条件への適性推定に大きく依存","第三者の調教評価、印、予想コラムは参照していない"]}
